"id";"type";"url";"authors";"authors_nb";"section";"tags";"tags_nb";"date_published";"date_modified";"share_count";"comment_nb";"title";"description";"text"
"5cc18e3ea2c3615169989ec4";"article";"https://www.theguardian.com/environment/2016/jan/20/john-mcdonnell-barred-from-giving-evidence-at-heathrow-13-trial";"Press Association";"1";"Environment";"Heathrow third runway, Travel and transport, Heathrow, Environment, Business, Airline industry, Air transport, Climate change, Greenhouse gas emissions, London, John McDonnell, Politics, Pollution, UK news, World news";"15";"1453301708000";"1518628765000";"0";"0";"John McDonnell barred from giving evidence at 'Heathrow 13' trial";"Judge deems evidence from shadow chancellor irrelevant in trial of 13 climate change protesters accused of blocking Heathrow runway in July last year";"Shadow chancellor John McDonnell has been barred from giving evidence in the trial of 13 climate change protesters accused of blockading a Heathrow runway. 
The group of Plane Stupid supporters are accused of cutting a hole in a fence and chaining themselves to railings on the north runway in July 2015. 
Labour MP McDonnell was due to be called as a defence witness in the case but his evidence was deemed irrelevant by the judge. McDonnell, whose Hayes and Harlington constituency includes the UK’s largest airport, is strongly opposed to the proposed third runway at Heathrow. 
District judge Deborah Wright said: “It (his witness statement) gives an opinion about the debate around the expansion of Heathrow and talks about the benefits of direct action, which he says may cause short term inconvenience.
“In order to allow his evidence to be given I have to be able to say that it is relevant. I am therefore not going to allow Mr McDonnell to give live evidence.” 
The activists are on trial at Willesden Magistrates Court charged with aggravated trespass and entering a security restricted area of an aerodrome. 
They admit being on the runway but claim their actions were necessary to stop people dying from the effects of pollution and climate change. 
One of the campaigners, Kara Moses, an environmental journalist, said they were wearing nappies in case they needed to go to the toilet during the protest. She said the group planned to block the runway all day and stop “hundreds” of planes from taking off. 
Wright asked: “If you thought you were going to be there all day, how were you going to address basic needs such as going to the toilet?” 
There was laughter from some of the defendants in the dock as Moses replied: “We were wearing nappies, madam.” 
The demonstration at around 3.30am on July 13 2015 caused delays for passengers around the world and 25 flights were cancelled. It came after a long-awaited report recommended a new runway should be built at Heathrow rather than Gatwick. 
Another protester Edward Thacker, a community worker and teaching assistant, said it was a “social justice” issue and he felt “compelled” to blockade the runway.
Green Party leader Natalie Bennett, who joined protesters outside court on the first day of the trial, was a character witness for one of the defendants, Melanie Strickland. In a statement read to the court she said Strickland was a “passionate, committed and knowledgeable” advocate of human rights issues and has written to her a number of times about climate change. 
Green party London mayoral candidate Sian Berry was also due to be a defence witness but her evidence was also ruled inadmissible.
It is alleged that on 13 July 2015 the defendants entered the northern runway at London Heathrow Airport, having trespassed on the land, and in relation to a lawful activity, namely the operations of landing and departing of aircraft which persons were engaged in on that land, did an act, namely erected a temporary structure and locked themselves to it, or within it, with the intent of disrupting that activity. 
The second charge alleges that they entered a security restricted area of an aerodrome without permission. 
The trial will resume at 10am on Monday when Wright is due to return verdicts in the case."
"5cc18e40a2c3615169989ec5";"article";"https://www.theguardian.com/environment/2016/jan/20/2015-smashes-record-for-hottest-year-final-figures-confirm";"Damian Carrington";"1";"Environment";"Climate change, Environment, UK weather, UK news, World news, Met Office, Natural disasters and extreme weather, US weather";"8";"1453303826000";"1520072500000";"0";"200";"2015 smashes record for hottest year, final figures confirm";"Experts warn that global warming is tipping climate into ‘uncharted territory’, as Met Office, Nasa and Noaa data all confirm record global temperatures for second year running";"2015 smashed the record for the hottest year since reporting began in 1850, according to the first full-year figures from the world’s three principal temperature estimates.
Data released on Wednesday by the UK Met Office shows the average global temperature in 2015 was 0.75C higher than the long-term average between 1961 and 1990, much higher than the 0.57C in 2014, which itself was a record. The Met Office also expects 2016 to set a new record, meaning the global temperature records will have been broken for three years running.
Temperature data released in the US on Wednesday by Nasa and by the National Oceanic and Atmospheric Administration (Noaa) also showed 2015 shattered previous records.
Experts warned that the record-breaking heat shows global warming is driving the world’s climate into “uncharted territory” and that it showed the urgency of implementing the carbon-cutting pledges made by the world’s governments in Paris in December.
Heatwaves have scorched China, Russia, Australia, the Middle East and parts of South America in the last two years, while climate change made the UK’s record December rainfall, which caused devastating floods, 50-75% more likely.
The Paris agreement commits the world’s nations to limit warming to below 2C compared to pre-industrial times, or 1.5C if possible, to avoid widespread and dangerous impacts. But the Met Office data, when compared to global temperatures before fossil fuel burning took off, shows that 2015 was already 1C higher.
A strong El Niño event is peaking at the moment, putting the “icing on the cake” of high global temperatures. El Niño is a natural cycle of warming in the Pacific Ocean which has a global impact on weather. But scientists are clear that the vast majority of the warming seen in 2015 was due to the emissions from human activity.
“Even without an El Niño, this would have been the warmest year on record,” said Prof Gavin Schmidt, director at Nasa’s Goddard Institute for Space Studies. He said he expected the long trend of rising global temperatures to continue because its principal cause – fossil fuel burning – was also continuing.
“It is clear that human influence is driving our climate into uncharted territory,” said Prof Phil Jones, from the University of East Anglia’s Climatic Research Unit, which produces the temperature record – called HadCRUT4 – with the Met Office. Peter Stott, at the Met Office’s Hadley Centre, said 2015 was the first year global average temperature was more than 1C above pre-industrial levels.
Noaa’s global temperature records stretch back to 1880 and it also found 2015 was the hottest year yet, beating the previous high by a record margin. The agency also found December was warmer than any other month in the record, when compared to long-term averages. Ten of the 12 months in 2015 had record high temperatures for their respective months, according to Noaa.
Nasa’s new data for 2015 also shattered its previous record and showed 15 of the 16 warmest years on record have occurred since 2001.
“Climate change is the challenge of our generation,” said Nasa head Charles Bolden. “Today’s announcement is a key data point that should make policymakers stand up and take notice - now is the time to act.”
 The Nasa, Noaa and HadCRUT4 temperature records all use independent methods to calculate the global average. They use many thousands of temperature measurements taken across the globe, on land and at sea, each day.
There are uncertainties in the measurements, partly due to fewer measurements in the polar regions, and these are included in the calculations. Stott said: “Remaining uncertainties are clearly much smaller than the overall warming seen since pre-industrial times.” Another independent temperature record, from the Japan Meteorological Agency, indicates 2015 was by far the hottest year on record.
Bob Ward, at the Grantham Research Institute on Climate Change at the London School of Economics, said: “This [record heat] should put pressure on governments to urgently implement their commitments to act against climate change, and to increase their planned cuts of greenhouse gases. The warming is already affecting the climate around the world, including dangerous shifts in extreme weather events. Those who claim that climate change is either not happening, or is not dangerous, have been conclusively proven wrong by the meteorological evidence around the world.”
Despite constantly rising greenhouse gas emissions trapping ever more heat on Earth, the last decade has seen relatively slow warming of air temperatures, dubbed a “pause” in climate change by some. In fact, global warming had not paused at all.
Instead, natural climate cycles led to more of the trapped heat being stored in the oceans (which already absorbed most the heat), some of which El Niño is now releasing. Scientists usually assess changes in climate over decades, rather than years, and the each of the last four decades has been warmer than any decade on record before. 
“It’s the long term warming trend we need to worry about rather than one hot year,” said Prof Piers Forster, at the University of Leeds in the UK. “So we shouldn’t get too excited - but it is certainly a sign of things to come.”"
"5cc18e42a2c3615169989ec6";"article";"https://www.theguardian.com/global-development-professionals-network/2016/jan/20/new-global-challenges-need-unprecedented-collaboration";"Dominic Waughray";"1";"Global Development Professionals Network";"Working in development, Global climate talks, Climate change, Greenhouse gas emissions, Sustainable development goals, United Nations, Davos, Davos 2016, Partnership";"9";"1453305998000";"1518628763000";"0";"21";"Wanted: unprecedented collaboration to solve poverty and climate change";"The SDGs have been set and a climate target agreed. The only question that remains is how the international community will meet them";"For the first time the world has agreed both a vision and a pathway for clean sustainable development.
Through the contributions of 188 countries, as well as thousands of additional commitments from states and cities, companies, foundations and international organisations, the Paris Agreement on Climate Change has given the world an ambitious goal for climate action.
The UN climate talks in Paris created important political momentum to get something meaningful done on climate change – momentum that is vital to spur aggressive emissions reduction and to cement a “clean” development dimension to the new sustainable development goals (SDGs) agreed in September.
The agenda for delivering this development now rightly intertwines inclusive economic growth, ambitious improvements in our social infrastructure for education, gender parity and improved health, as well as lower emissions.
The question now arises: how do we actually deliver this?
The challenge is enormous. The Paris Agreement recognises that the sum of countries’ Intended Nationally Determined Commitments (INDCs) for climate action, as it stands, will not be enough to keep within the agreed goal of staying below a 2°C rise.
The extra climate commitments made at Paris by countries and “non-state actors” – businesses, investors, cities, provinces and various action alliances – can provide a strong additional contribution to the INDCs, but these actors face daunting challenges because many of these commitments are interdependent. Industry often benefits from and needs policy reform to help transform to zero-emissions systems, governments usually need private and public finance these days, and financiers need well-structured projects, championed by the public and the private sector, to invest in.
In many cases success will be possible only through bold collaborations with diverse actors – public and private, incumbent and innovator, domestic and international. Think about the scale of new policies, projects and finance that will be required to move the world’s major cities towards becoming clean, sustainable urban systems by 2030. That’s the scale of the challenge the sustainable development goals and Paris Agreement have set us.
This ambitious new landscape requires innovative and to some extent unprecedented collaboration. Even those within the United Nations and other global organisations such as the World Bank recognise it will take more than the efforts of, for example, UNEP, the UNDP, and the UNFCCC to meet the new combined environment, development and climate goals.
Likewise, the CEOs of even the largest companies committed to climate action acknowledge the important role of governments (at city, state, national and international levels) to help them accelerate action. The Carbon Pricing Leadership Coalition is a good example of this new environment. Through interaction between international organisations, governments and companies, about 40 countries and 23 regions, states and cities now have mechanisms to put a price on carbon, representing about 12% of global greenhouse gas emissions. This alliance would have been unthinkable even five years ago.
Talk about the potential of such public-private partnerships and alliances abounds. To mobilise the resources, innovation and actors required to start delivering a clean, sustainable development agenda as soon as possible it is generally accepted that we require a new kind of operating system for development. Indeed, goal 17 promotes a new global partnership agenda for action to meet all the other goals. 
We will need a community of action to create new public-private networks and platforms in order to identify and deliver specific, large-scale partnerships across a number of key global economic sectors and geographies, particularly in emerging economies. There is no longer a “long-term” development agenda. Rather, the international community has constructed a “time-to-goal” global initiative – a decade-long delivery imperative for the public and private sectors to carry out together to meet both climate and development goals.
At the World Economic Forum’s Annual Meeting in Davos this week, numerous meetings will bring together public, private and civil society leaders to forge and advance these new alliances. These are not abstract activities. The platforms for public-private cooperation provided by the World Economic Forum Global Challenge Initiatives have achieved many things over the past year, such as the Sustainable Development Investment Partnership (SDIP), the Tropical Forest Alliance, and Grow Africa and Grow Asia addressing food security. 
All these initiatives will meet in Davos this week to help activate a new global delivery agenda. The overarching theme – Mastering the Fourth Industrial Revolution – will explore the sweeping changes created by digitisation and new technologies, including for delivery of the SDGs. Davos will be a meeting where the desire among global business leaders and investors to accelerate these new models into new markets, intersects with the desires of governments and the international community to start work on the new climate and sustainable development goals.
The common ground is new models for delivery. Will history look back on Davos 2016 as the dawn of a new delivery decade? Let’s hope so.
Join our community of development professionals and humanitarians. Follow@GuardianGDP on Twitter."
"5cc18e45a2c3615169989ec7";"article";"https://www.theguardian.com/environment/2016/jan/20/exxonmobil-possible-climate-change-coverup";"Anita Chabria";"1";"Environment";"Climate change, ExxonMobil, Environment, California, Oil, US news, Oil and gas companies";"7";"1453331763000";"1518629249000";"0";"183";"Billionaire supports reported inquiry into possible ExxonMobil cover-up";"Tom Steyer’s comments came hours after reports that California attorney general is looking into what the world’s biggest oil company knew about climate change";"Billionaire environmental activist Tom Steyer spoke out on Wednesday in support of an unconfirmed investigation by California into allegations that ExxonMobil spent decades lying to investors and the public about its knowledge of climate change.
 “We don’t have the facts yet, but I think that there is enough that has been revealed that it’s totally appropriate that (California) be conducting this investigation,” Steyer told the Guardian. “Anybody who puts out intentionally misleading information I think should be answering to us.”
 Steyer’s comments came hours after the Los Angeles Times reported that California’s attorney general, Kamala Harris, is looking into what ExxonMobil, the world’s biggest oil company, knew about climate change going as far back as the early 1980s. 
 Harris’s office declined to comment on the report, writing in an email: “We can’t comment on any ongoing or potential investigation,” according to press secretary Rachele Huennekens.
 Previously published reports suggest ExxonMobil may have spent millions over 27 years to publicly promote opposition to climate change science while privately basing strategies and business models around it.
 The Guardian reported in July on a company email from Exxon’s in-house climate expert that provided evidence that the company was aware, over a generation ago, of the connection between fossil fuels and climate change, and the potential for carbon-cutting regulations that could hurt its bottom line. It may have factored that knowledge into its decision about a large gas field in southeast Asia. The field, off the coast of Indonesia, would have been the single largest source of global warming pollution at the time.
New York’s attorney general is also conducting a similar probe into ExxonMobil based on previously published reports by the Los Angeles Times and the Columbia University Energy and Environmental Reporting Fellowship.
 But, Steyer said, California, as the “largest and most populous state” offers a “particularly strong platform” to increase the reach of any investigation. 
 “I’m not a lawyer but I believe the laws in California are different and give our attorney general a lot of leeway in terms of how she approaches it,” he said. 
 RL Miller, chair of the California Democratic party’s environmental caucus, added that the Los Angeles and Ventura Democratic party recently passed a resolution she wrote calling on Harris to investigate ExxonMobil. Harris is currently running for US Senate and will seek the party’s endorsement during its February convention.
 “I wanted to bring it up with Democrats because if she wants the Democrats’ endorsements, she needs to listen to Democrats,” said Miller of her outreach to Harris. 
 Like other climate change activists, Steyer also linked ExxonMobil’s alleged cover-up to similar scandals in the tobacco industry, which for many years fought to deny the negative health effects of smoking. 
 With climate change, “there is obviously a gigantic impact on the entire world and all the people of the world”, said Steyer. “It’s a society being misled.”"
"5cc18e55a2c3615169989ec8";"article";"https://www.theguardian.com/science/video/2016/jan/21/2015-the-warmest-year-on-record-by-quite-a-big-jump-video";"0";"0";"Science";"Climate change, Environment, Science, Australia weather, UK weather, US weather, Climate change";"7";"1453337980000";"1520072505000";"";"0";"2015 the hottest year on record by 'quite a big jump' – video";"National Oceanic and Atmospheric Administration says year broke with the trend of incremental rises in record temperatures";NA
"5cc18e57a2c3615169989ec9";"article";"https://www.theguardian.com/environment/2016/jan/21/victorian-farmers-call-for-pipelines-to-save-their-region-from-climate-change";"Michael Slezak";"1";"Environment";"Climate change, Farming, Agriculture, Victoria, Australia news, Environment, Australasia, World news, Australia weather";"9";"1453348473000";"1518628761000";"0";"200";"Victorian farmers call for pipelines to save their region from climate change";"Record dry weather in the usually wet farming regions of south-west Victoria forces farmers to queue for water and leads to push for future-proofing";"Record dry weather in the usually wet farming regions of south-west Victoria has forced farmers to queue for water from a community bore, and led to calls for infrastructure that will future-proof the region in relation to climate change.
Two winters with little rain, followed by completely dry springs and summers have left livestock producers in the west Wimmera and southern Grampians with record low levels of water storage, Tim Leeming, a farmer and regional chair of the Southern Australia Meat Research Council told Guardian Australia.
The region has the highest concentration of red meat production in the country, and produces 40% of Australia’s lamb, Leeming said. 
“If there is a mild winter and another failed spring this year, there will be hell to pay. It will be mega serious,” he said. “Producers will be forced into another agricultural enterprise like cropping – and that’s out of their skill set and not really supported by the landscape.
“You hesitate to mention climate change but we all know that in the last decade we’ve experienced the latest-breaking season in 40 years, we’ve experienced the wettest season in 65 years and two failed springs in a row – that has never occurred before.”
Leeming is calling for councils and the state government to build a pipeline to the nearby Rocklands reservoir, currently used to provide water for regions further north.
Jonathan Pollock, a climatologist at the Bureau of Meteorology, confirmed that the region had broken several records for dry weather and said it was most likely a result of climate change. 
“Rainfall in Victoria’s south-west was average to below average in December, but it also happened to be the warmest on record for most or all of that area, too,” he said. Record dry weather was also seen there in winter and spring of 2015, Pollock said. “Looking further back, parts of south-west Victoria are the driest on record at 18-month and 39-month time spans.”
The Bureau of Meteorology said in its most recent drought statement the dry weather was unlikely to be a result of natural changes and is probably due to climate change. 
“This suggests the tendency for recurrent dry conditions is less related to variations such as El Niño, and more due to other changes in the climate system,” it said. “Research suggests that long-term drying trends over southern Australia cannot be explained by natural variability alone.”"
