"id";"type";"url";"authors";"authors_nb";"section";"tags";"tags_nb";"date_published";"date_modified";"share_count";"comment_nb";"title";"description";"text"
"5cc1963aa2c361516998a05a";"article";"https://www.theguardian.com/environment/2016/jan/12/state-of-the-union-no-let-up-for-barack-obamas-climate-agenda";"Suzanne Goldenberg";"1";"Environment";"Climate change, Environment, Barack Obama, Obama administration, US news, World news, State of the Union address, Energy, Fossil fuels, COP 21: UN climate change conference | Paris, Greenhouse gas emissions, Global climate talks, Paris climate agreement";"13";"1452599480000";"1518632009000";"0";"54";"State of the Union: no let-up for Barack Obama's climate agenda";"Final address expected to see the president flag his historic achievements and set out the remaining items on his climate agenda";"Barack Obama will look back on 2015 as a banner year for climate change in his final State of the Union address on Tuesday evening.
But 2016 will see the president back in the trenches, fending off law suits and Republican attacks that could undo his climate plan, and scrambling to get to key items on his to-do list before exiting the White House.
In a sign of the battles yet to come, Mitch McConnell, the Senate majority leader, said he had invited as his guest a Kentucky coalminer who lost his job when his mine shut down, a gesture intended as a rebuke to Obama.
Administration officials and campaign groups said Obama is unlikely to let up in his final year in the White House: pursuing new rules to cut methane emissions from the oil and gas industry and pressing Congress to increase funding to communities hit hard by flooding, drought and other extreme weather events fuelled by climate change.
2015 was Obama’s biggest year for climate change with the finalisation of the clean power plant rules, rejection of the controversial Keystone XL pipeline, ban on Arctic drilling and, in December, the forging of an historic global agreement in Paris to limit warming below 2C – all of which are expected to get a mention in Obama’s speech.
“Under President Obama’s leadership, the United States has done more to combat climate change than ever before,” the White House said in a fact sheet prepared for the address. 
Administration officials said Obama planned to keep up the pace in the remaining months of his term. “2016 is not going to be a year we slow down. It’s a year we build on the momentum of the historic year that passed,” Gina McCarthy, the head of the Environmental Protection Agency, told the Council on Foreign Relations last week. 
Officials said Obama will take centre stage in a signing ceremony for the Paris global warming agreement at the United Nations in April.
 “You can be sure that the United States will be doing what ever we can to get a lot of momentum into early entry into force of this agreement,” Paul Bodnar, senior energy and climate director at the National Security Council, said.
But the president will be racing to the finish line to roll out the remaining items on his climate agenda – which are critical to delivering on the emissions goals he promised in Paris.
In the weeks ahead, Obama is expected to roll out long-awaited rules to cut methane emissions from oil and gas wells and landfills, a rising source of climate pollution.
The White House has spent the last six months on a final review of proposed new rules cutting methane, more than 80 times as warming as carbon dioxide in the 20-year timeframe.
The administration is also expected to tighten curbs on heavy vehicle emissions.
Analysts said that Obama will need to double down to meet the target of cutting emissions 17% on 2005 levels by 2020 set at the start of his presidency in 2009, and even more ambitious goal of 26%-28% cut in emissions by 2025 pledged under the Paris climate agreement.
Some of those targets were based on assumptions that have not materialised - such as rapid growth of hybrid and electric vehicles. In 2011, Obama set a goal of 1m electric cars by 2015, but record low oil prices have sent consumers back to pick-up trucks and SUVs.
The administration said it can find other areas to cut. White House officials told a seminar at the Centre for Strategic and International Studies last week that they hoped to amend the Montreal protocol ozone treaty this year to ban hydrofluorocarbons, which are used in air conditioning and are 10,000 more warming than carbon dioxide. The EPA estimates a ban could shave off 0.5C of warming.
Obama was also counting on an international aviation agreement to help pare emissions. 
But Obama’s main focus will be ensuring that the rules cutting carbon emissions from power plants – the biggest single US climate pledge - survive a legal and political onslaught.
McCarthy told an event at the council on Foreign Relations last week the administration wanted to do all it could to ensure the power plant rules remain “cast in stone”.
She said the administration would spend its remaining months implementing the clean power plant rules, and defending the regulations from legal challenges.
The speech promises Obama one of the last big moments to elevate the climate cause. In his 2015 state of the union address, the president said: “No challenge poses a greater threat to future generations than climate change.”
Obama is unlikely to ease up on climate now.
 "
"5cc19640a2c361516998a05c";"article";"https://www.theguardian.com/politics/blog/live/2016/jan/12/pupils-at-risk-from-postcode-inequality-clegg-says-politics-live";"Andrew Sparrow";"1";"Politics";"Politics, UK news, Nick Clegg, Education, David Cameron, Syria, Foreign policy, Islamic State, Middle East and North Africa, World news, Climate change, Environment";"12";"1452624082000";"1523728718000";"";"200";"Cameron questioned by MPs about Syria, climate change and flooding - Politics live";"Rolling coverage of all the day’s political developments as they happen, including David Cameron’s evidence to the Commons liaison committee on Syria and climate change";"Here are the main points from David Cameron’s evidence to the liaison committee. At times it got rather tetchy, and Andrew Tyrie certainly delivered on his promise to deliver “robust questions”. (See 3.35pm.)
 I’m very happy to do that, I think if people make offers and the churches have made offers, we should try and take them on.
I suppose you could say that means Cameron wants to help more people be like Helen Pidd (a very good ambition for any government.)
You have to be incredibly careful with highly sensitive information, information that if revealed could result in somebody’s death. The source that gave you that information would be, could be, at risk. 
You are asking me should the government have no hold back on the intelligence it gives to the ISC? Instinctively I would be very worried about that because there might be a piece of intelligence so sensitive that its release in anyway could endanger the source of that intelligence. In that case, the government should keep that intelligence as tightly held as possible.
The failure to engage in nation building has created a breeding ground for Isil ([Isis].
Cameron said the Libyans did not want the West to “go in heavy handed with boots on the ground” to help them construct a government. He told Tyrie:
We were involved in nation building. We were there to help the Libyan people. We tried to do it in a way that was more remote than what had happened in Iraq. On this occasion, clearly it didn’t work.
They are not all the sort of people you would bump into at a Liberal Democrat party conference.
I totally disagree with anyone who says that on the one hand Britain has helped to pioneer this climate change agreement and on the other hand is somehow backsliding on its green commitments. It’s total and utter nonsense ...
Whether you look at solar or offshore wind - where we have the biggest offshore wind market anywhere in the world - whether you look at the Green Investment Bank, which is the first in the world, whether you look at the fact that we are reinvesting in our nuclear programme, whether you look at the fact that we are the first developed country to say that we are going to phase out coal-fired power stations, on any reasonable assessment, you would say that Britain is more than fulfilling its green commitments.
That’s all from me for today.
Thanks for the comments.
Andrew Tyrie goes next.
Q: A civil servant called Iain Mansfied wrote a prize-winning report on what Brexit might look like. But he is not allowed to give evidence to select committees about this. Will you let him do so, in a personal capacity?
Cameron says he did not know this case would come up. But civil servants are expected to support the government’s position, he says, implying the answer will be no.
And that’s it. The hearing is over. 
I will post a summary soon.
Crispin Blunt takes Cameron back to foreign affairs.
Q: Islamic State (Isis) need to be taken out of the part of Syria where they are in control. One soldier said, if the regional armies did not do this, we should. Isis could be rolled up in weeks, he said. Has planning for this started?
Cameron says he does not agree with that approach.
It would be counterproductive to deploy Western troops in this way, he says. 
He says the action taken in Syria has taken out 25% of their oil revenues, 10% of their revenues overall.
Cameron says he had a constituency case where farmers dredged a stream. They were being taken to court by the Environment Agency. The agency thought they were destroying the habitat for water voles. As they inspected the river, two water voles appeared - making the point that the water voles had not lost their homes.
Neil Parish, the Conservative chair of the environment committee, goes next.
Q: What is your long-term plan on flooding?
Cameron says one part is building capital schemes. Another part is getting partnership funding, so the private sector contributes to the cost of flood defences. 
He also wants all government departments to address flooding issues.
For example, after the Somerset floods, the government asked the Dutch for advice.
People says don’t build on a flood plain. But London is a flood plain, and we need to build there, he says. 
Q: Will farmers be encouraged to take on water and manage it? Farmers need a carrot to do this.
Cameron says that makes a lot of sense.
Q: Why did you scrap the carbon capture and storage investment despite promising to put £1bn into it?
Cameron says the last two governments have poured money into these new technologies.
But at the moment the CCS technology is not working. You could spend £1bn, but the technology would not be competitive in the market. 
The government hoped the costs would come down. But they did not.
The CCS would still cost £170 per megawatt hour. That compares with nuclear energy costing £90, or onshore wind costing £70.
Q: But you are cutting subsidies for onshore wind too.
Cameron says the cost of energy from onshore wind is coming down.
Angus MacNeil, the SNP chair of the energy committee, goes next.
Q: There are claims that RAF airstrikes have resulted in the death of about 80 civilians in Iraq. Are these claims being investiagated?
Cameron says, at the time of the Syria debate, the government’s information was that there had not been any civilian deaths as a result of RAF attacks in Iraq.
Q: Independent monitoring groups think there have been between 72 and 81 deaths.
Cameron says if that is what is being claimed, the government can investigate.
Cameron says the governnment needs to do more. We have seen three “one in 100 year” events since 2007.
We need to get better at everything, he says.
But this time the military got involved more quickly, and money was dispersed more rapidly.
In the past the Environment Agency used to balance protecting homes against protecting the environment. That has changed. Now they have been told to prioritise protecting homes.
Q: You have faced criticism for not pursuing a green agenda in the UK, even though you pushed it in the Paris talks.
Cameron says he totally disagrees.
Let’s take solar, he says.
Q: What about international investment in renewables. On the Ernst &amp; Young analysis, we have tumbled down the ratings.
Cameron says he does not accept that.
98% of solar panels installed in the UK have been installed since he became prime minister.
We are the first developed country to say we will phase out coal-fired power stations.
He says greenhouse gases fell by 8% last year.
Q: There was good British and EU leadership on this. Has this made you rethink your views on an in/out EU referendum?
Cameron says this shows what can be achieved when Britain works with its European partners.
They are now switching to climate change, and Huw Irranca-Davies, the Labour chair of the environmental audit committee, goes next.
Q: What was your verdict on the Paris talks?
Cameron says he thought the outcome was pretty good. At one point it had looked as if 2 degrees would be lost as a target, that there would be no review mechanism, and that the call for progressively increasing ambitions would be taken out.
He says he always knew there would be some deal. But it turned out to be better than it might have been. He praises the role played by Amber Rudd, the energy secretary.
Clive Betts, the Labour chair of the communities committee, goes next.
Q: How are the extra costs on services generated by taking in Syrian refugees going to be paid for?
Cameron says we have a well-funded health service and well-funded education system. It was considerations like this that made him decide taking in 20,000 Syrians would be right.
He says he wanted local authorities to come forward and offer to take refugees, and they did.
Q: In the case of Siddhartha Dhar, he was asked to give up his passport. But it was 36 days before the police followed that up. Mark Rowley, the Met head of counter-terrorism, told my committee this afternoon that bail powers were toothless. He said that there should be immediate handover of passports, and that breach of bail should be a criminal offence.
Cameron says he is happy to look at this. He knew Rowley was going to make these points.
Cameron says for years it was impossible to get information about passengers travelling in the EU. He says Vaz’s committee has done good work on this.
The hearing has resumed. Keith Vaz is asking questions again.
David Cameron says he thinks EU border controls are getting better. But there is a desire to do more. Within the last month there has been a breakthrough on passenger records, he says.
There is a vote in the Commons now, so the sitting has been suspended for 15 minutes.
Cameron says he will be back. Although, judging by his exchange with Andrew Tyrie (see 4.46pm), it wouldn’t be surprising if he decides he has had enough.
(My transcript write-up probably does not do justice to quite how tetchy and bad-tempered this got. Cameron and Tyrie were repeatedly talking over each other, and at some points Cameron’s usual bonhomie vanished. There were moments when it seemed he was losing his temper.)
Keith Vaz, the Labour chair of the home affairs committee, goes next.
Q: Congratulations for reaching the target of taking 1,000 Syrian refugees by Christmas. Why did the numbers go up so quickly just before Christmas?
Cameron says he would like to say it was having an activist prime minister. The government has kept the pressure up on this, he says.
Q: Will you look again at taking up offers from individuals and churches offering to take refugees?
Cameron says he is happy to look at this. But it was right to focus on what local authorities could do first.
Q: Will all relevant information held by ministers be released to the ISC?
Cameron says he will look at this, but his instinctive answer would be no.
Q: We have a committee (the ISC) there to do this job. They are full of intelligent people.
Cameron says you have to be “incredibly careful” with “highly sensitive information”. People’s lives could be at risk, he says. There may be occasions when it is not safe to release information because a source may be at risk.
Cameron says it is his job to be sceptical of requests like this. He could say yes, but he might find he was not able to keep the country safe."
"5cc19643a2c361516998a05d";"article";"https://www.theguardian.com/politics/2016/jan/12/david-cameron-denies-backsliding-on-the-environment";"Damian Carrington";"1";"Environment";"Climate change, David Cameron, Green politics, Flooding, Renewable energy, Rivers, Solar power, Agriculture, Environment, Conservatives, Politics, Climate change, Energy, UK news";"14";"1452636883000";"1518631769000";"0";"200";"David Cameron denies 'backsliding' on the environment";"Prime minister rejects suggestion by liaison committee that government is failing in its approach to green energy, climate change and flooding";"David Cameron has defended his government’s record on the environment and climate change, saying suggestions of backsliding are “total and utter nonsense”. The prime minister also told the liaison committee, made up of MPs who chair select committees, that the government needs to do “more of everything” to deal with the flooding that has repeatedly hit the UK in recent years.
Cameron, who pledged in 2010 to lead the “greenest government ever”, has faced concerted criticism over a series of reversals to green policies, including cuts to renewable energy subsidies and energy efficiency programmes. In November, the government cancelled its £1bn competition for carbon capture and storage (CCS) technology, despite the project being in the Conservative party’s election manifesto.
Cameron said that spending on low-carbon energy was set to double to £11bn in this parliament and that there had been an “absolute revolution in renewable energy” during his premiership, with 98% of solar energy installed since 2010. Subsidies for solar power will be slashed this week, but Cameron said: “You do have to think as prime minister that every penny you put in is a penny on energy bills.”
The SNP’s Angus MacNeil, chair of the energy and climate committee, challenged this, saying onshore wind was the cheapest clean energy, but was being drastically restricted by the government. 
Cameron told the liaison committee in December 2014 that CCS, which traps CO2 from coal and gas power plants and buries it, was “absolutely crucial if we are going to decarbonise effectively”. But he defended the scrapping of the £1bn policy, which was designed to help develop commercial-scale CCS, saying, “The economics are not working at the moment.” This was contradicted by US energy secretary Ernest Moniz, on 7 January, who tweeted: “Carbon capture is critical for solving climate change. And it’s working.”
The prime minister highlighted the UK’s pioneering Climate Change Act and the carbon budgets it sets for the nation, and said: “We are more than meeting the targets.” However, a leaked letter in November revealed that the UK was not on track to meet an EU target for green energy in 2020. Furthermore, experts have argued, the government’s renewed dash for gas, including fracking, without CCS will make meeting future carbon targets extremely difficult.
Tidal power has been promoted by chancellor George Osborne, who signalled support for a project in Swansea Bay. But Cameron poured cold water on the technology, saying that the current proposals were too expensive: “We have not seen any proposals coming forward that would would beat the [subsidy] strike price.”
Friends of the Earth chief executive Craig Bennett said: “If dismantling a dozen green policies and putting 19,000 solar workers on notice isn’t ‘backsliding on green commitments’, I don’t know what is.”
Cameron was challenged on flooding by Huw Irranca-Davies, chair of the environment audit committee, who quoted one expert stating that the UK’s “current approach to flooding was not only inadequate, but has no likelihood of ever being adequate”. Cameron cut flood defence spending in 2010, only raising it after floods hit later, and has been repeatedly warned of the UK’s rising risk of floods.
“On flooding, there is no doubt we need to do more,” Cameron said. “We’ve seen what are called one-in-100-year events, or one-in-200-year events, and they happened in 2007, 2013, 2015, and the country wants us to do more, and we will do more.”
The controversial issue of river dredging was raised by Neil Parish, chair of the environment, food and rural affairs committee, who praised Cameron for restarting dredging on the Somerset Levels. 
The government is going to allow farmers to dredge ditches without securing permission from the Environment Agency, but experts have warned of the risk of faster-flowing rivers rising more quickly and increasing the risk of flood to towns and villages downstream.
Mark Lloyd, chief executive of the Angling Trust, said recently: “It is scandalous that the government has hidden from public view the advice of its own experts on the dangers of unregulated dredging and ignored the findings of the study into the pilot dredging projects. The evidence shows that the best way to reduce the risk of flooding is to manage land upstream to reduce the flow of water and soil off fields.”
Cameron said a suggestion from Parish that farmers were given more incentive to store water on their land during periods of high rainfall made “very good sense”.
The prime minister recounted an anecdote from the village of Kelmscott in his constituency when he visited a site where farmers were being sued by the EA for dredging without permission. Cameron said the EA was worried that some of the habitat of the water vole might have been destroyed. “At that moment, two water voles appeared on the river bank, almost in conversation, and in my mind, at that moment, the argument was settled,” he said."
