"id";"type";"url";"authors";"authors_nb";"section";"tags";"tags_nb";"date_published";"date_modified";"share_count";"comment_nb";"title";"description";"text"
"5cc18d90a2c3615169989ea8";"article";"https://www.theguardian.com/environment/2016/jan/28/australia-drops-10-spots-in-greg-hunts-most-trusted-climate-rankings";"Michael Slezak";"1";"Environment";"Greenhouse gas emissions, Climate change, Energy, Environment, Greg Hunt, Australia news, Yale University";"7";"1453938852000";"1518631947000";"0";"200";"Australia drops 10 spots in Greg Hunt's most trusted climate rankings";"Environment minister has described Yale’s environmental performance index as ‘the most credible ... in the world’ but Australia performs badly in latest ratings";"The index that Greg Hunt used to defend Australia’s record on climate change has placed the country lower in its rankings, leaving only Saudi Arabia with a worse ranking among wealthy nations in some categories.
Yale’s environmental performance index ranks countries’ performance in protecting human health and ecosystems, and looks at nine areas including air quality, climate and energy, forests and water resources.
When Australia’s climate change policies were questioned in November, the environment minister relied on the index to defend its record. “The Yale environment performance index, the most credible, scientifically based, hard data-based analysis in the world, ranks Australia number three of 178 countries in terms of our environmental performance,” he told ABC’s 730.
The index’s report, released this week, shows Australia has dropped 10 places overall, leaving it at 13 out of 180 countries examined. 
 It performed worst in the climate and energy category. It was ranked 150th for its trend in carbon emissions each kilowatt hour, leaving only Saudi Arabia behind among wealthy nations. Overall in the climate and energy category, Australia was ranked 82nd.
While global CO2 emissions appear to have dropped in 2015 for the first time during a period of economic growth, Australia’s emissions have continued to grow. 
Mark Butler, Labor’s spokesman on the environment, told Fairfax Media: “The Yale report states that over the last decade ‘nearly every country has improved it’s [index] score’ – every country, that is, except Australia … The Turnbull government is taking Australia backwards at a shocking pace.”
Hunt’s office has been contacted for comment."
"5cc18d91a2c3615169989ea9";"article";"https://www.theguardian.com/environment/2016/jan/22/europe-falls-behind-us-new-plans-tackle-co2-emissions-planes";"Arthur Neslen";"1";"Environment";"Greenhouse gas emissions, Climate change, Environment, Air transport, World news, Airline industry, Business, Europe, US news";"9";"1453446001000";"1518628757000";"0";"84";"Europe lags behind US in new plans to tackle CO2 emissions from planes";"Europe’s proposals for landmark international fuel efficiency standard for aircraft would save considerably less carbon emissions than those put forward by the US";"Europe is calling for a considerably less ambitious carbon emissions standard for airplanes than the US in a new global push to reduce aviation’s contribution to climate change, the Guardian has learned.
The standard would mark a turning point for efforts to regulate fast-growing emissions from airplanes, which are not covered by December’s much-hailed Paris climate agreement.
The milestone would apply to new models and existing aircraft put into production after 2020, but the EU’s preferred version would be less stringent than alternative US proposals, which the Guardian has also seen. Both blueprints have been filed with the UN’s civil aviation agency, Icao, ahead of talks in Montreal next month.
“The US proposal is definitely more ambitious,” said Joris Melkert, a former flight test engineer and senior aerospace lecturer at Delft University in the Netherlands. “It would save more emissions, and the difference is quite considerable.”
The gap between the two proposals is greater than the annual emissions of most medium-sized European countries, and privately confirmed by EU officials. 
Aviation is responsible for around 5% of the world’s global warming at present and the industry is growing so fast that, on current trends, it could make up 22% of global emissions by 2050, according to a recent European Parliament study.
The Icao talks are pursuing a twin track approach of making airlines pay a cost for their CO2 output under a market-based scheme, and greening aircraft with a new fuel efficiency standard.
 The debate on the standard began in 2007 and proposals agreed in Montreal will be sent on to an Icao council for approval next year. “After many years, decision time has finally come,” one EU official said. “I believe that we are going to have an ambitious standard and I hope we can secure it next month.”
Airplanes emit CO2 in the process of burning engine fuel to provide a lift force that can overcome the aerodynamic drag created by wind resistance. For this reason, the Icao proposals focus on measures to improve planes’ aerodynamics, lightness and engines.
Under the technical proposals, a stringency option of ‘9’ suggested by the US would reduce overall aircraft emissions by 37.5%, while the ‘7’ setting favoured by the EU would imply a 33% cut. The 4.5% gap is equal to 350m tonnes of CO2, or slightly more than Spain emits every year.
EU officials privately concede that their proposal is “the second most ambitious of the positions put on the table”. But they insist that it is still “quite close to the US one” and that the agreement’s small print on cargo aircraft and categorisations should not be overlooked. 
Environmentalists argue that the involvement of the Environmental Protection Agency and an unshackled president Obama in the US has contributed to the relative weakness of the EU’s position.
But insiders in Brussels say that the sheer variety of complex issues still to be agreed – and the amount of aircraft manufacturing countries involved, from Brazil and Ukraine to India and China – make like-for-like comparisons unwise, and stringency factors of ‘10’ impossible.
“There are so many parameters to be decided that it creates a lot of pieces you can move around on a chessboard,” one EU source told the Guardian.
Europe has proposed a 60 tonne threshold for classifying aircraft, as this could cover 90% of emissions and apply to aircraft of the size of a Boeing 737 or Airbus 320 and above.
But the classification would be further sub-divided between new model types and those in production; jets ferrying 19 people or less, and planes carrying freight instead of passengers. Alternate starting dates of 2020 and 2023 for the benchmark are other options under discussion.
An EU source said: “We need a standard that reflects the state of art of the technology, that is as close as possible to what engineers are capable of doing, without going so high that a number of 60-tonne aircraft types would be put out of the market as that would be environmentally unhelpful, economically detrimental and also quite unfair, as lead-in times for aircraft take about 10 years.”"
"5cc18d95a2c3615169989eaa";"article";"https://www.theguardian.com/environment/2016/jan/13/cutting-diesel-pollution-puts-climate-change-target-at-risk-says-vw-uk-chief";"Adam Vaughan";"1";"Environment";"Pollution, Environment, Volkswagen (VW), Business, Automotive industry, Travel and transport, Greenhouse gas emissions, Climate change, UK news";"9";"1452711649000";"1518629257000";"0";"39";"Cutting diesel pollution puts climate change target at risk, says VW UK chief";"Boss of carmaker that cheated on tests of toxic NOx emissions downplays impact of scandal and says diesel vehicles needed to reduce CO2 levels";"Taking too many diesel cars off the road because they have been blamed for Europe’s air pollution problems would risk the industry missing its climate change targets, the boss of Volkswagen UK has warned.
Last year it emerged that Volkswagen had cheated on tests for emissions of nitrogen oxides (chemical name NOx), the name for the toxic gases nitric oxide (NO) and nitrogen dioxide (chemical name NO2), both of which are found in diesel fumes. Paul Willis, managing director of VW UK, told MPs on Wednesday that tackling NO2 emissions could come at the expense of cutting carbon dioxide (CO2) emissions from cars – the greenhouse gas seen as a major contributor to climate change.
NO2 is responsible for nearly 6,000 annual premature deaths in London, parts of which breached annual limits last week.
“I would say that unless we have a significant diesel mix in Europe, within our fleet, we will miss that target, not VW, the industry will miss that [CO2] target,” said Willis, referring to the EU target of an average new car emitting 95g CO2 per kilometre by 2021, compared to an average of 123.4g CO2 per km in 2014.
Transport is responsible for around a quarter of European Union greenhouse gas emissions, so moves to cut them are seen as vital to climate change efforts.
During an often heated exchange with environment, food and rural affairs committee MPs, Willis defended VW’s environmental record but conceded the company had to win back consumer trust after the revelations last year that 12m of its cars were equipped with “defeat devices” to cheat NOx emissions tests.
“For almost everyone in our company to learn what we learned in September [when the scandal emerged] was very difficult for us to swallow and very difficult for us to understand. I think you heard the apologies I made at that time and I’m still really sorry for that.” He said the company would redouble efforts to win back trust.
But owners of the 1.2m VW cars in the UK affected by the diesel emissions testing scandal should not receive any compensation because they have not suffered any loss, he argued. “To pay compensation, there has to be a loss. At this stage I see no reason for there to be a loss. The adjustment of the software, our engineers are telling us, there will be no difference in in fuel consumption as a result of this fix. 
“The other area is on the question of residual values, I have seen no clear evidence there has been any adverse impact on residual values.”
A survey last year found that nine out of 10 VW drivers in Britain affected by the scandal believed they should receive compensation, in addition to the software fix that VW is rolling out to customers.
Asked whether consumers would begin to factor health into their purchasing decisions, Willis said that pollution emissions were not a priority for most car-buyers.
“I’m sorry to tell you but look at the data and look at what customers’ priorities are when they’re buying vehicles, they don’t talk about NOx,” he said.
He said the scandal had had some effect on its sales in November and December but noted that retail orders in December 2015 were actually higher than orders in December 2014. “I think people know there was an error in the testing regime, and they understand in the real world there was no difference at all,” he said.
Asked how much more NO2 had been emitted as a result of his company cheating on the tests, Willis repeated previous assertions that it was impossible to say because there is no agreed standard for “real world” emissions.
Mike Hawes, chief executive of the Society of Motor Manufacturers and Traders, sitting next to Willis, said the technology for testing real world emissions had only been available for two to three years.
Separately on Wednesday, VW’s chief executive Matthias Müller is meeting regulators in Washington to attempt to reach agreement with US authorities on a solution for the affected cars. On Sunday he appeared to downplay the idea the company had cheated tests, telling NPR it was simply a “technical problem” not an “ethical problem”."
"5cc18d98a2c3615169989eab";"article";"https://www.theguardian.com/environment/2016/jan/19/chinas-coal-burning-in-significant-decline-figures-show";"Damian Carrington";"1";"Environment";"Coal, Environment, China, Renewable energy, Asia Pacific, Energy, Fossil fuels, World news, Climate change, Greenhouse gas emissions, Pollution";"11";"1453215390000";"1518631980000";"0";"148";"China's coal-burning in significant decline, figures show";"Official data shows coal use fell in 2015 across a wide range of measures as world’s largest polluter continues its transition to clean energy";"Coal-burning in China is in significant decline, according to official figures released on Tuesday, signalling a major turnaround for the world’s biggest polluter.
The new data is good news for the fight against climate change but bad for the struggling global coal industry.
China saw a huge increase in coal-burning for power and industry in the last two decades but has suffered serious air pollution as a result. However in recent years there has been a surge in low-carbon energy and a slowdown in the economy - GDP growth fell in 2015 to its lowest in 25 years - as China moves away from manufacturing.
The result is that global carbon emissions are set to continue the fall seen in 2015 for the first time outside of worldwide recessions, potentially for many years.
“This trend may continue for 3-5 years or even longer,” said Li Junfeng, director general at the National Climate Change Strategy Research and International Cooperation Centre, a thinktank close to China’s government. “Today’s figures are sending the strong signal of the clear acceleration of China’s energy transition. I think thermal [coal] power generation will continue to drop with an annual speed of 2-4% and the non-fossil power generation will stay in a high growth rate of 20%.”
Tim Buckley, at the Institute for Energy Economics and Financial Analysis, said: “The implications of these changes are huge. China’s total emissions are on track to peak potentially a decade earlier than their official target of no later than 2030.
“This comes at the same time that the US has confirmed a 10% year-on-year decline in coal consumption in 2015, plus a three-year moratorium of new federal coal mine leases. That the largest economies globally are moving rapidly in concert to exceed the Paris [climate change] agreement sets a very positive scene for 2016.”
China’s coal use has fallen in 2015 across a wide range of measures and its national carbon emissions are likely to have fallen by about 3% as a result. There was a 3.5% drop in coal production, coal-fired electricity generation fell 2.8% and overall power generation dropped 0.2%, the first fall in 50 years. There were similar decreases in coal-intensive heavy industry such as iron, steel and cement. 
Other recent developments were coal imports to China plummeting by 35% year-on-year in December 2015 and the government’s ban on new coal mines for three years.
In contrast, renewables investment in China hit an all-time high in 2015 at $110bn. Overall low-carbon electricity generation - hydro, wind, nuclear and solar - increased more than 20% in 2015.
“The growth of non-fossil-fuel power generation in China in the past few years is the largest deployment of renewable energy in history,” said Greenpeace’s Lauri Myllyvirta. “This has enabled China to cover a 20% increase in power demand from 2011 to 2015 with clean energy while reducing coal use in the power sector, an astounding achievement.”
Benjamin Sporton, chief executive at the World Coal Association, said: “The cyclical slowdown in economic growth in China is affecting all energy and commodity markets, including coal. Long-term forecasts however show that coal will remain the backbone of the Chinese electricity mix for decades to come and that China will remain the world’s largest producer and consumer of coal.”
He said the International Energy Agency expects coal demand in south-east Asia to grow at 4.6% a year through to 2040.
“Rather than focussing on short-term fluctuations and wishing coal away, it is important to focus on making sure coal is used in the cleanest way possible with high-efficiency low-emission plants using modern emission control technologies and working to develop carbon capture and storage,” Sporton said.
But Li said: “Coal production and consumption [in China] has entered into a turning point since 2014. Even if it bounces back in the future, it will not be big bounce.”
A series of major coal companies have gone bankrupt in recent years, as the international coal price fell by 60% since 2011. The second biggest coal miner in the US, Arch Coal, filed for bankruptcy last week. Investment bank Goldman Sachs declared in January 2015 that the fuel had reached “retirement age”."
"5cc18dcea2c3615169989eac";"article";"https://www.theguardian.com/commentisfree/2016/jan/13/the-guardian-view-on-the-economic-and-environmental-impact-of-falling-oil-prices";"Editorial";"1";"Opinion";"Oil, Oil, Commodities, Business, Energy, Fossil fuels, Environment, Oil and gas companies, Energy industry, Saudi Arabia, Middle East and North Africa, World news, Iran, Renewable energy, COP 21: UN climate change conference | Paris, Greenhouse gas emissions, Climate change, Global climate talks, Global economy";"19";"1452714600000";"1518631996000";"0";"53";"The Guardian view on the economic and environmental impact of falling oil prices | Editorial";"Editorial: The economic implications of the tumbling cost of crude are momentous but mixed. For the environment, though, it should at least mean that more fossil fuels stay in the ground";"A decade ago, British civil servants were packed off on a training day about, in a then-fashionable phrase, future-proofing UK plc. The idea was to game the mid-century economy on a range of feasible assumptions, one of which concerned the oil price. There was an “expected case” for 2050 of $45 a barrel, a “best case” of $35 and a “worst case” of $55. So much for the bureaucratic imagination. Over the short years since, the price has twice been more than double the so-called worst case, and then twice also come skidding down by two-thirds.
We are currently in the midst of a great oil collapse, with prices sinking to within touching distance of $30 on Tuesday afternoon, 73% down on 18 months ago. As with every climb up and every slip down the greasy price pole, analysts are scrambling around to figure out whether the change will endure. Nobody can know, but when financial sentiment swings, some always conclude that it will soon swing even harder. The RBS note for investors which this week unleashed a note of panic by advising them to “sell everything” mentioned the possibility of $16 a barrel, a number with little obvious basis apart from being half the current price.
But there are solid reasons why the world has now convinced itself that oil is worth much less than before. On one side of the ledger there is supply, not only of oil itself, but also of the other fossil fuels which can often substitute for it, notably gas, which is more abundant than anyone would have imagined a few years ago, courtesy of the fracking boom. On the demand side, things have been developing even more rapidly, with a serious slowdown in the resource-intensive emerging economies, above all debt-laden China. The fracking revolution will not be reversed, and it increasingly looks like the Chinese flu will be hard to shake. All of which suggests that low oil prices could be here for a while.
So is this a good thing or not? The potentially profound geopolitical consequences are considered in today’s other editorial. Economically, the standard western assumption is that cheap oil is a boon. Certainly, price spikes have arrived shortly before recessions, as in 1973, 1979-80 and 1990. But cheap oil can be a consequence as well as a cause of economic weakness, as it was in 2008, when it became a mere symptom of the great recession. The best that can be said of cheap oil today is that the global slowdown would be sharper without it.
What of the environmental effect? Here, although the story is complex, there is more reason for optimism. Start with the premise of the Guardian’s Keep it in the Ground campaign, that the only way to avoid catastrophic climate change is to leave the bulk of the world’s remaining fossil fuels where they are. Cheap oil encourages waste; worse, it discourages investment in a more efficient “energy infrastructure”. Renewables, as well as upgrades to clean up fossil fuel power stations, yield less return. Drivers feel less pressed to trade in their SUV for a G-Wiz, and car manufacturers are less inclined to concentrate R&amp;D on fuel economy.
But cheap oil also discourages investment in fossil fuel extraction. Already, this week has seen BP scale back its North Sea operation. Indeed, one reason why the Saudis are prepared to endure $30 a barrel is because they hope it will discourage American frackers from switching their focus from gas to oil, and making investments that – once the capital is sunk – become too costly to abandon. If “keeping it in the ground” is indeed the priority, this is the worst outcome of all; by discouraging it, cheap oil is a force to the good.
Bargain-basement energy should also be the spur for far-sighted politicians to act on carbon pricing and other regulations and taxes that can’t be done when prices are high. In Paris last month, world leaders wrote post-dated cheques to the planet. Cheap oil is the opportunity to make a down payment."
