"id";"type";"url";"authors";"authors_nb";"section";"tags";"tags_nb";"date_published";"date_modified";"share_count";"comment_nb";"title";"description";"text"
"5cc18ed3a2c3615169989ee5";"article";"https://www.theguardian.com/sustainable-business/2016/jan/28/climate-change-capitalism-business-emotions-heathrow-protest-short-term-profits";"Christopher Wright";"1";"Guardian Sustainable Business";"Guardian sustainable business, Business (Australia), Climate change, Environment, Technology, Heathrow airport, Heathrow third runway, Corporate social responsibility, Business, UK news";"10";"1453981544000";"1518628749000";"0";"43";"The best thing a business could do for the environment is shut down";"... of course, they’re not going to do that. So how do managers balance their climate change fears and the reality of the business world?";"Earlier this week Tim Sanderson, a former executive of the fossil fuel giant BP, wrote about the pride he felt for his daughter after her involvement in a climate change protest at Heathrow airport. With 12 others from climate activist group Plane Stupid, Rebecca Sanderson had occupied a runway to highlight the conflict between airport expansion and escalating carbon emissions.
Having spent most of his working life in oil exploration, Sanderson said he was an “unlikely apologist” for his daughter’s actions. However, climate change had become a galvanising issue for his family. When his daughter and her colleagues were convicted for aggravated trespass – and face a likely jail term – the former oil executive stood with other protesters loudly chanting: “No ifs, no buts, no new runways”. As with a growing number of business people, Sanderson’s story demonstrates how climate change has become an increasingly personal business.
In our book, Climate Change, Capitalism and Corporations, Daniel Nyberg and I explore how businesses and the managers who run them are responding to the climate crisis. A key finding of our research is that climate change poses a fundamental challenge to business as usual. While corporations frame climate change through the optimistic prism of innovation, technology and “green” products and services, the unpleasant reality is that our existing economic system fundamentally undermines a habitable climate.
For a number of managers, awareness of the environmental destruction that our economic system is exacting poses deep moral and emotional questions. Some chief executives have spoken candidly about their concerns for the future of humanity and their desire to change our trajectory. Often such epiphanies are cast from the personal and emotional realisation of the world they are leaving to their children. As the Californian venture capitalist John Doerr confided in a tearful TED talk about climate change and his teenage daughter: “I’m scared. I don’t think we’re going to make it.”
The emotional engagement with climate change is particularly relevant for those whose task is to make their companies more “sustainable”. Here, personal concerns about the environment run directly up against the competing logic of short-term profitability and shareholder value. This was highlighted with stark candour early on in our research by a sustainability adviser in a large Australian consulting firm who told us:
 “I would say that most businesses’ efforts, probably with a genuine intent, are more about appearing to be environmental and reducing impact where possible where there’s a business case for doing so ... because the best thing a business could do for the environment would be to shut down … But that’s clearly not a viable option.”
Many environmentally concerned managers thus operate in a conflicted space: they can advocate for greater corporate environmental sustainability but this must not threaten business growth. 
Responding to the inevitable gap between corporate rhetoric and action requires significant emotional labour, although ironically the outcome may be that emotions need to be deliberately left aside. For example, a sustainability manager at a major Australian property developer explained how he often downplayed his environmental concerns and framed his appeals for renewable energy to the company’s chief financial officer around cost improvements: “There’s nothing [in the discussion] about climate change. You can’t talk about drought and floods. We looked at this stuff, but they can’t get hold of it.” 
Many of those we spoke to also often compartmentalised their feelings about climate change between work and home. They might voice strong environmental values at home or among like-minded colleagues, but would moderate their views in the presence of more senior colleagues. As the sustainability manager at a national insurer admitted: “That’s the other challenge: how do you have passion without being seen as too passionate?” Essentially, fervour for the environment often needed to be tempered in the corporate space by fervour for the market.
However, many managers noted the need to sometimes stand strong and challenge business assumptions. Here the personal became the political by stepping outside convention and opposing proposals entailing environmental harm. As a manager in a major global food company told us: “We have to be the voice of the environment ... so sometimes decisions are made and those considerations aren’t there, and we’ve got to be the ones who stand up and say no.” For some of the managers we interviewed, these were pivotal events for them that involved putting their jobs on the line, or even leaving their companies to pursue alternative careers.
Of course personal responses are not sufficient to change an economic system hard-wired for environmental destruction. However, they demonstrate the potential for an individual’s emotional engagement to begin the process of corporate and political change. 
Future visions of a climate-shocked world prompt strong emotional responses, whether our concerns focus on the extinction of animal species, humanitarian disasters, or the wellbeing of our society or our children. Rather than denying our emotional responses to the climate crisis, we need to use them to champion alternative narratives to business as usual. 
Christopher Wright and Daniel Nyberg’s book, Climate Change, Capitalism and Corporations: Processes of Creative Self-Destruction, explores the role of business in the climate crisis
"
"5cc18ed6a2c3615169989ee6";"article";"https://www.theguardian.com/environment/2016/jan/28/no-need-to-increase-uk-carbon-budget-in-light-of-paris-deal-say-climate-advisers";"Fiona Harvey";"1";"Environment";"Climate change, Committee on Climate Change, Greenhouse gas emissions, Environment, Politics, UK news, COP 21: UN climate change conference | Paris, Carbon capture and storage (CCS), Global climate talks, Paris climate agreement";"10";"1453982889000";"1518629243000";"0";"120";"No need to tighten UK carbon budget in light of Paris deal, say climate advisers";"Green campaigners disappointed by advice from the Climate Change Committee not to revise budget that is currently based on keeping global warming to 2C rather than the new target of 1.5C";"The UK’s carbon budget for the early 2030s does not need to be tightened despite a tougher global warming target agreed in Paris last month, the government’s climate advisers have told ministers.
Campaigners said a letter published on Thursday from the Committee on Climate Change (CCC) to energy and climate secretary, Amber Rudd, was “desperately disappointing” for failing to increase the ambition of the so-called fifth carbon budget in light of the Paris climate deal.
Nearly 200 governments in Paris agreed to work towards keeping global temperature rises below 1.5C above pre-industrial levels, a more exacting target than the 2C previously agreed on by leaders, and which the UK carbon budgets are based on. It also required a longterm reduction to net zero emissions, which is more ambitious than the UK’s Climate Change Act.
The proposed fifth carbon budget’s 57% cut in emissions by 2032 was laid out before Paris by the committee, and has yet to be legislated on. In today’s letter, it said the budget’s demands were the minimum necessary to meet the UK’s international responsibilities under the Paris accord.
New government policies would be needed to reach this target, the committee wrote in its letter, because current policies would not be enough. 
The current Conservative government has rowed back on a variety of carbon-cutting strategies, for instance by slashing the subsidies available for onshore wind and solar power; abandoning the green deal scheme for encouraging home insulation, without a replacement policy; and scrapping the target for zero-carbon homes.
Craig Bennett, Friends of the Earth’s CEO, said: “This is desperately disappointing advice from the government’s climate advisor. Last month the international community agreed to ‘pursue efforts’ to keep global temperature rises to 1.5C – the Committee on Climate Change should have provided comprehensive advice and guidance on what measures the UK needs to take to help achieve this.”
Richard Black, director of the Energy and Climate Intelligence Unit, a UK-based thinktank, said it was sensible the committee had reviewed the carbon budget after Paris but added: “The committee also pointed out that we currently have little idea how this government intends to reduce emissions, let alone ensure energy security. Having spent its first six months emptying the energy policy cupboard, it has yet to re-stock and thereby give investors the confidence they need to get us back on track.”
The CCC also issued a stern warning on the future of carbon capture and storage (CCS) technology. 
Last year, the government scrapped a long-standing competition offering at least £1bn in funding for CCS. The future of the fledgling technology in the UK is now in doubt.
But the CCC said that research suggested the cost of meeting the UK’s carbon goals by 2050 would be twice as high without CCS technology. “CCS has a crucial role to play in cost-effective decarbonisation technology,” the committee wrote in the letter to Rudd.
Professor Stuart Haszeldine, director of the Scottish Carbon Capture and Storage group, said: “To stay on track in the ‘high ambition coalition’ of leading nations agreed in Paris climate talks, the UK needs to do a lot more on UK electricity, and a lot more on UK low-carbon industry and low-carbon heat. 
“But now this government is doing a lot less. There is no sign yet that facts, unbiased scientific evidence and rationality are regarded as more important than lobbying by corporations and colleagues wishing to take the UK back to the 1960s energy mix.”

"
"5cc18ed8a2c3615169989ee7";"article";"https://www.theguardian.com/world/video/2016/jan/28/leonardo-dicaprio-meets-the-pope-video";"0";"0";"World news";"Pope Francis, Environment, World news, Climate change, Fossil fuels, Catholicism, Energy, Religion, Leonardo DiCaprio";"9";"1453992429000";"1518631708000";"";"0";"Leonardo DiCaprio meets the pope – video";"Oscar-nominated actor Leonardo DiCaprio meets with Pope Francis at the Vatican to discuss their shared views on climate change";NA
"5cc18ed9a2c3615169989ee8";"article";"https://www.theguardian.com/global-development-professionals-network/2016/jan/28/live-qa-financing-paris-agreement-climate-change";"Rachel Banning-Lover";"1";"Global Development Professionals Network";"Impact and effectiveness, Working in development, Climate change, Renewable energy, Energy, Access to energy, Energy efficiency, Energy industry, Energy, United Nations, COP 21: UN climate change conference | Paris, Global climate talks, Greenhouse gas emissions, Business, Environment, World news, Live Q&As, Paris climate agreement";"18";"1453993405000";"1518631707000";"0";"155";"Live Q&A: So now we've agreed to stop climate change, how will we pay for it?";"In Paris last year 195 countries committed cutting emissions and reducing global warming. Join a panel on Thursday 4 February to discuss making these a reality";"On Wednesday the United Nations urged global business leaders to double investment in wind and solar energy to $600bn (£400bn) a year by 2020. The announcement comes one month after the Paris climate agreement, where nearly 200 countries agreed to dramatically cut emissions. This week UN secretary general Ban Ki-moon urged business leaders to act decisively to hasten the transition away from the fossil fuel economy – or they would put the historic accord in jeopardy.
But even if business leaders do reach this ambitious target, it only marks the start of the investment needed to meet the agreed 1.5 degree target. The International Energy Agency has estimated that to hit this taget the world will need to spend more than $16trn (£10.55trn) over the next 15 years, to cover the costs of replacing coal and gas-fired power stations with emissions-free sources of energy such as wind, solar and nuclear as well as the costs for improving existing energy efficiency in homes and businesses.
So who’s going to foot the bill? What can developing countries do to help ensure we reach the 1.5 degree target? How can markets be used to promote private-sector solutions to climate change? And what can be done to create effective alliances to deliver the ambition of the Paris agreement? 
Join an expert panel on Thursday 4 February, 1-3pm GMT, to discuss these questions and more.
PanelGeorge Wamukoya, member of the African Group of Negotiators, Nairobi, KenyaGeorge was a co-facilitator of some of the elements of the Paris Agreement.
Sam Barnard, research officer, Overseas Development Institute, London, UK @samuelmarchSam conducts research on how international finance can best support low-carbon and resilience building investments in developing countries 
Brandon Wu, senior policy analyst, ActionAid, Washington DC, USA @brandoncwuBrandon works on generating climate finance for developing country mitigation/adaptation. Former representative to Green Climate Fund Board.
Virginie Fayolle, senior economist, Acclimatise, London, UK @VirginieFayolleVirginie focuses on climate adaptation planning. As part of the Seychelles COP21 delegation, she provided advisory support to the Indian Ocean Commission.
Anthony Hobley, CEO, Carbon Tracker Initiative, London, UK @arhobley @CarbonBubbleAnthony has 20 years experience working on the financial market solutions to a climate secure economy. @carbonbubble
Aaron Atteridge, research fellow, Stockholm Environment Institute, Stockholm, Sweden @SEIclimateAaron co-leads SEI’s research initiative on the effectiveness of climate finance.
Karen Orenstein, senior analyst, Friends of the Earth US, Washington DC, USA @KarenOrenstein @foe_usKaren’s work focuses on the provision of funds by developed countries for developing countries to take environmentally-sound, socially-just climate action. 
Joe Thwaites, research analyst, World Resources Institute, Washington DC, USA @WRIFinanceJoe researches ways that international climate finance can enable transformative low-emissions, climate-resilient development.
Remco Fischer, programme officer, UNEP Finance Initiative, Geneva, Switzerland @UNEP_FIRemco oversees projects aimed at helping align the operations of the finance sector with economic development which is ‘low-carbon’ and ‘climate-resilient’. 
Tim Ash Vie, head of climate change, Adam Smith International, London, UK @AdamSmithIntTim leads the direction and implementation of large donor-funded climate change programmes across Africa and Asia.
The live chat is not video or audio-enabled but will take place in the comments section (below). Get in touch via globaldevpros@theguardian.com or @GuardianGDP on Twitter to recommend someone for our expert panel. Follow the discussion using the hashtag #globaldevlive."
"5cc18edca2c3615169989ee9";"article";"https://www.theguardian.com/environment/2016/jan/28/independent-greenland-could-not-afford-to-sign-up-to-paris-climate-deal";"John Vidal";"1";"Environment";"Climate change, Greenhouse gas emissions, Fossil fuels, COP 21: UN climate change conference | Paris, Denmark, Greenland, Energy, Environment, Europe, Global climate talks, World news, Oil, Gas, Paris climate agreement";"14";"1453994942000";"1518631945000";"0";"75";"Independent Greenland 'could not afford' to sign up to Paris climate deal";"Fossil fuel exploitation that would trigger a rise in carbon emissions is necessary to support the country financially in its break from Denmark, leaders say, despite it being one of the most climate-affected places in the world";"One of the parts of the world being hit the hardest by climate change says it cannot afford to submit to the new Paris agreement to cut emissions and is likely to dramatically increase its contribution to global warming.
Greenland, which is almost the size of Europe but with a population of less than 60,000 people, is a self-governing territory of Denmark.
However, it is seeking full independence from Denmark and will only be able to survive on its own by exploiting its proven oil, gas and mineral reserves, which could take its emissions to some of the highest per capita on Earth.
“The economic situation gives us no choice but to develop mining and oil. We would most likely [seek] a territorial reservation. It would be very costly if we were to submit to a binding agreement,” the administration’s foreign minister, Vittus Qujaukitsoq, told the Guardian at a meeting of Arctic countries in Tromsø, Norway.
The deputy foreign minister, Kai Holst Andersen, said Greenland would likely seek a territorial opt-out from the Paris deal, agreed by nearly 200 countries last month. “If we sign it will cost us hundreds of millions of dollars and we would never be independent,” he said. While Greenland is not a party to the UN Framework Convention on Climate Change, which shepherded the Paris deal, Denmark is.
Greenland receives a block grant of nearly $1bn a year from Denmark, around half its income. If it chose independence this would be lost, said Andersen.
New emissions restrictions on Greenland would be almost impossible to honour, said Andersen. “If we want to make a living we cannot afford to make an agreement that will bind us [to cutting emissions]. We are not an independent state. Independence is cancelled if we sign [Paris].”
Under the previous Kyoto climate agreement, which applied to Denmark and other rich countries, Greenland had an emission quota of 650,000 tonnes of CO2 a year - less than is emitted by a single coal-fired power station. The Paris deal covers emissions curbs post-2020.
Greenland’s position will not affect the ratification of the Paris agreement, which will come into force when signed by 55 countries that produce at least 55% of the world’s greenhouse gas emissions. This is due to take place at a ceremony in New York in April.
But it gives a clear signal to rich countries that they will have to urgently find ways to help poorer countries and regions to finance emission cuts. Many developing countries have said that they will be unable to fulfil their pledges without considerable help. How this money is raised has not been decided, but is likely to be with a mix of carbon trading, taxes and development assistance. 
Climate change in the Arctic is believed to be taking place faster than anywhere else with Greenland seeing rapid changes in farming, fishing and development. Mining has become easier as ice retreats and new species of fish enter Greenland waters, but the traditional way of life has been severely disrupted and the melting of the Greenland ice cap is taking place faster than anticipated, giving rise to fears of sea level rise. 
“We are seeing the effect of climate change much more clearly now. We must address it in any way we can to make the rest of the world understand how it is affecting all life and livelihoods,” said Qujaukitsok.
“It is is a blessing and a curse for us. We must address it in any way we can. It is affecting our life and ecosystems. It is posing threats but also offering new opportunities,” he said.
Climate change in Greenland was highlighted in the Paris talks when tonnes of ice from one of its fjords were placed in front of the Pantheon to show rapid melting and to inspire negotiators to come up with an ambitious global deal. "
"5cc18edea2c3615169989eea";"article";"https://www.theguardian.com/environment/2016/jan/29/modern-european-summers-are-warmest-since-roman-times-study-finds";"Arthur Neslen";"1";"Environment";"Climate change, Climate change, Europe, Environment, Science, World news, Greenhouse gas emissions";"7";"1454043665000";"1518628747000";"0";"200";"Modern European summers are warmest since Roman times, study finds";"Average summer temperatures in Europe are about 1.3C hotter than two millennia ago due to manmade climate change, scientists say";"Europe has almost certainly experienced warmer summers in the last three decades than at any other time since the Roman empire, according to a study published on Friday in the Environmental Research Letters journal.
Since 1986, mean summer temperatures have been about 1.3C hotter than they were two millennia ago, while heatwaves have been longer, more frequent and more persistent, the study says.
The paper was compiled by 40 prominent academics, using tree-ring analysis, climate modelling and historical documentary evidence from the notes of doctors, priests and monks.
“This degree of warming is unprecedented in the last two thousand years,” Professor Jürg Luterbacher, the report’s coordinator, told the Guardian. “It is exceptionally high and cannot be explained by natural variability, tropical volcanoes or solar changes. It is because of anthropogenic [manmade] climate change.”
While the paper offers new insights into the effects that volcanic eruptions, solar variability and land use change can have on climate, its range is limited to periods between June and August. 
Much of the data for the period before 755 comes from analysis of tree rings and density information from three pine tree species in Finland, Austria and Sweden. These trees grow in warm weather but are dormant in the cold, meaning that their rings, density – and the outside temperatures – can only be measured in summer. 
After 755, more pine trees in countries such as Switzerland, France and eventually Spain become accessible to the scientists, allowing spatial variations – or regional differences – to be more accurately recorded, and comparisons to be drawn.
“The anomalous recent warmth is particularly clear in southern Europe, where variability is generally smaller, and where the signal of anthropogenic climate change is expected to emerge earlier,” the report says.
The report finds evidence that past swings in summer temperatures were larger than previously thought. It says that summers were warmer between Roman times and the third century, before cooling until the 7th century.
A warmer medieval interlude was then punctured by a ‘Little Ice Age’ that lasted from the 14th to the 19th centuries. As the 20th century dawned, the effects of climate change became progressively more pronounced.
“Summer temperatures during the last 30 years have been anomalously high and we find no evidence of any period in the last 2,000 years that has been so warm,” the paper says. "
